{
  "id": "550e8400-e29b-41d4-a716-446655440000",
  "title": "Manchester City Dominates Premier League with Stunning Victory",
  "content": "In a thrilling match that showcased the very best of Premier League football, Manchester City delivered a masterclass performance that left fans and pundits alike in awe. The Citizens' tactical prowess and individual brilliance combined to create a spectacle that will be remembered for years to come.\n\nFrom the opening whistle, City demonstrated why they are considered one of the world's elite football clubs. Their possession-based style of play, orchestrated by their midfield maestros, created numerous scoring opportunities throughout the match. The team's ability to maintain composure under pressure and execute their game plan with precision was truly remarkable.\n\nThe match statistics tell the story of complete dominance, with City controlling 68% of possession and registering 15 shots on target compared to their opponents' 4. This level of control is a testament to the tactical preparation and individual quality within the squad.",
  "summary": "Manchester City delivered a commanding performance in their latest Premier League fixture, showcasing tactical excellence and individual brilliance in a match that highlighted their championship credentials.",
  "author": "John Smith",
  "sport": "soccer",
  "league": "Premier League",
  "game_id": "123e4567-e89b-12d3-a456-426614174000",
  "status": "published",
  "published_at": "2024-01-15T14:30:00Z",
  "tags": ["Manchester City", "Premier League", "Football", "Victory", "Analysis"],
  "featured_image_url": "https://example.com/images/man-city-victory.jpg",
  "reading_time_minutes": 5,
  "seo_keywords": ["Manchester City", "Premier League", "football match", "victory", "analysis"],
  "byline": "John Smith is a sports journalist with over 10 years of experience covering Premier League football."
}
